"SITE_ID", "GROUP_ID", "VARIABLE_GROUP", "SITE_DESC", 
"US-SJ1", "30988", "GRP_SITE_DESC", "Half hour data files are available at: http://www.ess.uci.edu/~marsh/. This is one of two paired flux towers that were located in separate ponds that were subject to different water treatments (US-SJ1 and US-SJ2). Tower 1 is located near the central-eastern edge of the 1000 by 300 m marsh. placing it on the far side from the predictable easterly oceanic breeze. The San Joaquin Marsh is one of the final remnants of a wetland, prior to the early 1900's, covered 2100 ha along San Diego Creek. Most of the regional wetlands were drained for agriculture in the early 20th century. Despite regional wetland removal, the San Joaquin remained intact. During the 1950's, vegetation was cleared to promote duck hunting. No further disturbances have occurred since the clearing. The hydroperiod is partly managed by the SJFM VC Reserve and the Irvine Ranch Water District. During the spring months, water volume begins to reduce by evapotranspiration and subsurface draining. The remaining standing water disappears during the summer. The wetland is annually replenished in January and December to a depth of 1 m in an effort to mimic natural hydrocycles.", 
"US-SJ2", "30989", "GRP_SITE_DESC", "Half hour data files are available at: http://www.ess.uci.edu/~marsh/. This is one of two paired flux towers that were located in separate ponds that were subject to different water treatments (US-SJ1 and US-SJ2). Tower 2 is located in the southeastern corner, placing it on the farthest side from the predictable easterly oceanic breeze. The San Joaquin Marsh is one of the final remnants of a wetland, prior to the early 1900's, covered 2100 ha along San Diego Creek. Most of the regional wetlands were drained for agriculture in the early 20th century. Despite regional wetland removal, the San Joaquin remained intact. During the 1950's, vegetation was cleared to promote duck hunting. No further disturbances have occurred since the clearing. The hydroperiod is partly managed by the SJFM VC Reserve and the Irvine Ranch Water District. During the spring months, water volume begins to reduce by evapotranspiration and subsurface draining. The remaining standing water disappears during the summer. The wetland is annually replenished in January and December to a depth of 1 m in an effort to mimic natural hydrocycles.", 
"US-Skr", "11912", "GRP_SITE_DESC", "The Florida Everglades Shark River Slough Mangrove Forest site is located along the Shark River in the western region of Everglades National Park. Also referred to as site SRS6 of the Florida Coastal Everglades LTER program, freshwater in the mangrove riverine floods the forest floor under a meter of water twice per day. Transgressive discharge of freshwater from the Shark river follows annual rainfall distributions between the wet and dry seasons. Hurricane Wilma struck the site in October of 2005 causing significant damage. The tower was offline until the following October in order to continue temporally consistent measurements. In post-hurricane conditions, ecosystem respiration rates and solar irradiance transfer increased. 2007- 2008 measurements indicate that these factors led to an decline in both annual -NEE and daily NEE from pre-hurricane conditions in 2004-2005.", 
"US-Slt", "13041", "GRP_SITE_DESC", "Wildfires, prescribed fires, insect defoliation events and windstorms are the common disturbances in the NJ Pinelands.  The oak-dominated forest at Silas Little Experimental Forest was most recently defoliated by Gypsy moth (Lymantria dispar L.) in 2006 to 2008, with complete defoliation occuring in 2007.  Following this multi-year defoliation event, oak mortality was significant, and resulted in the death of approximately 20 % of the overstory oaks, and a similar reduction in stand biomass.  Previous disturbances have included windstorms and earlier Gypsy moth defoliation events in the 1990's.  The last major wildfire to occur at and near the Experimental Forest was in 1963.  Since then, a number of prescribed fires have been conducted in the vicinity of the Silas Little flux site.", 
"US-Snd", "30333", "GRP_SITE_DESC", "The Sherman Island site is a 38-ha peatland pasture, west of the Delta, that is owned by the state and managed by the California Department of Water Resources. The site is degraded and heavily grazed with ~100 cattle in the area that circumscribes the main field and fetch. The island has been drained and farmed since the late 1800s. The soils of the Delta overlay deep peat that was sequestered over the Holocene period as sea-level rose and flooding of archaic wetlands prevented decomposition of roots and stems. Hence, the upper 10 m of peatland has been lost to decomposition, compaction, and subsidence. Today a mineral soil overlays a peat layer, which coincides with the general depth of the water table.

This site was discontinued in 2015 as the land was converted into a restored wetland.  A new site was established in 2016 nearby, US_Sne", 
"US-Sne", "30013", "GRP_SITE_DESC", "A new restored wetland on the old Sherman Pasture site. The new tower is about 67m northwest (300deg) of the old tower site.", 
"US-Snf", "84775", "GRP_SITE_DESC", "The Sherman Barn is pasture site on Sherman Island, that is managed by the California Department of Water Resources (DWR). A flux tower equipped to analyze energy, H2O, CO2, and CH4 fluxes was installed on June, 2018", 
"US-SO2", "15927", "GRP_SITE_DESC", "The Sky Oaks Old site is located near the Sky Oaks Field station, owned and operated by San Diego State University. Chaparral vegetation, associated with a Mediterranean climate, covers nearly half of the rough and rocky terrain. Precipitation is almost exclusively confined to the winter months. During the summer and early fall, hot and dry Santa Ana winds from the northeast bring desert heat to the site. A high intensity natural wildfire occurred in July of 2003. The stand age at the time of the wildfire was 80 years old, following an early wildfire poorly characterized. Following the 2003 wildfire, most native chaparral began to regrow from root stocks reaching a height of 1.0 m in 2008.", 
"US-SO3", "15945", "GRP_SITE_DESC", "The Sky Oaks Young site is located near the Sky Oaks Field station, owned and operated by San Diego State University. Chaparral vegetation, associated with a Mediterranean climate, covers nearly half of the rough and rocky terrain. Precipitation is almost exclusively confined to the winter months. During the summer and early fall, hot and dry Santa Ana winds from the northeast bring desert heat to the site. A high intensity natural wildfire occurred in July of 2003. The stand age at the time of the wildfire was 10 years old, following a controlled burn in 1993.", 
"US-SO4", "15911", "GRP_SITE_DESC", "The Sky Oaks New site is located near the Sky Oaks Field station, owned and operated by San Diego State University. Chaparral vegetation, associated with a Mediterranean climate, covers nearly half of the rough and rocky terrain. Precipitation is almost exclusively confined to the winter months. During the summer and early fall, hot and dry Santa Ana winds from the northeast bring desert heat to the site. A high intensity natural wildfire occurred in approximately 1905. Physical characteristics prior to the 1905 burn are unknown, including stand age and canopy height. Currently, the Sky Oaks New site is an excellent representation of an old-growth chaparral ecosystem, with a canopy height of 2.3 m and chamise-dominated overstory.", 
"US-SP1", "2835", "GRP_SITE_DESC", "The ACMF site is a 67 hectare naturally regenerated Pinus palustris and Pinus elliottii mixed stand.", 
"US-SP2", "7966", "GRP_SITE_DESC", "Even aged slash pine (Pinus elliottii) plantation. Planted in Jan. 1999.", 
"US-SP3", "9651", "GRP_SITE_DESC", "Slash pine planted end of 1989 early 1990. Gholz and Clark, 2002. Agric. Forest Meteo. 112, 87 - 102;  Ckark et al., 2004. Ecological Applications, 14, 1154 - 1171.", 
"US-SP4", "4117", "GRP_SITE_DESC", "Only active for one year, the Rayonier tract site was shutdown due to a stand replacing wild fire in 1998. The tower was relocated to the Donaldson tract. The characteristics between the two mid-rotation pine plantations are nearly indistinguishable, enabling the integration of measurements made at both towers. The site information provided below follows the convention that the two sites are nearly identical.", 
"US-SRC", "10140", "GRP_SITE_DESC", "Part of the Santa Rita Experimental Range since 1901; Site vegetation has been dominated by Creosote bush since at least 1934", 
"US-SRG", "11853", "GRP_SITE_DESC", "Semidesert C4 grassland, lies in Pasture 1 on the Santa Rita Experimental Range.  This is the companion site for US-SRM, but has much less mesquite encroachment.", 
"US-SRM", "11184", "GRP_SITE_DESC", "Semidesert grassland encroached by mesquite (Prosopis velutina) trees. Please see Scott et al. 2009 JGR-Biogeo, 114, G04004", 
"US-Srr", "30960", "GRP_SITE_DESC", "This site is a 4.57 km2 brackish tidal marsh located in the San Francisco Bay National Estuarine Research Reserve (SFBNERR, http://www.nerrs.noaa.gov/reserves/san-francisco-bay.html) in Suisun Bay, CA, USA. Suisun Bay is the most extensive contiguous brackish marsh complex in California. This site is classified as a high marsh, which according to the National Wetland Inventory, is representative of over 58% of estuarine wetlands.", 
"US-SSH", "30693", "GRP_SITE_DESC", "The Susquehanna Shale Hills Critical Zone Observatory is comprised of one first-order catchment in the Susquehanna River basin. This catchment, known as Shale Hills, is about 8 hectares in total area. The stream that defines the Shale Hills catchment flows into Shavers Creek in the Juniata River sub-basin. The vegetation cover at Shale Hills is dominated by deciduous broadleaf forest, with some evergreen needleleaf
trees along the stream.", 
"US-Sta", "12502", "GRP_SITE_DESC", "Sagebrush steppe ecosystem", 
"US-StJ", "13295", "GRP_SITE_DESC", "This tower is located in St Jones, near Dover Delaware. This area is part of the National Estuarine Research Reserve. It was established in 1993, and estuarine ecosystems from the Mid-Atlantic region are represented here. This region has been influenced by agricultural fields along the watershed. The EC tower is located in a tidal marsh near the Dover headquarters, there is a board walk that goes along the marsh. Restoring natural vegetation is on the long term management plan.", 
"US-StS", "30113", "GRP_SITE_DESC", "Located in a degraded coastal swamp on the Hobcaw Barony Property near Georgetown, SC. Swamp was previously used for rice cultivation in the 19th century, but has not been used for these purposes since. The coastal swamp was formally a freshwater bald cypress/tupelo forest  that was continuously flooded. However, in recent years a salinity gradient has developed over the gradient of the ecosystem causing the forest to transition to a wax myrtle shrub forest to the west of the tower where salinity is higher.", 
"US-SuM", "13069", "GRP_SITE_DESC", "Continuous, irrigated, sugarcane cultivation for >100 years.  Practice is to grow plant sugarcane for 2 years, drydown, burn leaves, harvest cane, and then till and replant very shortly after harvest.  Site differs from Sugarcane Windy and Sugarcane Lee/sheltered in soil and meteorology.", 
"US-SuS", "13088", "GRP_SITE_DESC", "Continuous, irrigated, sugarcane cultivation for >100 years.  Practice is to grow plant sugarcane for 2 years, drydown, burn leaves, harvest cane, and then till and replant very shortly after harvest.  First cycle of observations were from July 2011 to November 2012.  Second cycle was from April 2013 to December 2013.  Site differs from Sugarcane Windy and Sugarcane Middle in soil type and meteorology.", 
"US-SuW", "13109", "GRP_SITE_DESC", "Continuous, irrigated, sugarcane cultivation for >100 years.  Practice is to grow plant sugarcane for 2 years, drydown, burn leaves, harvest cane, and then till and replant very shortly after harvest.  Site differs from Sugarcane Lee/Sheltered and Sugarcane Middle in soil type and site meteorology.", 
"US-Syv", "15322", "GRP_SITE_DESC", "Old growth forest consisting primarily of sugar maple and eastern hemlock.  Note that a small lake to the north and data analyses suggest that wind direction screening is appropriate (see Desai, A.R., Bolstad, P.V., Cook, B.D., Davis, K.J., and Carey, E.V., 2005. Comparing net ecosystem exchange of carbon dioxide between an old-growth and mature forest in the upper midwest, USA. Ag. For. Met. 128(1-2): 33-55 (doi: 10.1016/j.agrformet.2004).  Site was chosen to represent an end member representative of the upland forests in the WLEF tall tower flux footprint.  (Note, however, that old growth forests are not found within the WLEF tall tower flux footprint.)", 
"US-SZ1", "85799", "GRP_SITE_DESC", "This site is located at St. John, WA and currently under a crop rotation that consists of winter and spring crops. This site is under no-tillage management.", 
"US-SZ2", "85837", "GRP_SITE_DESC", "This site is located at St. John, WA and currently under a crop rotation that consists of winter and spring crops. This site is under no-tillage management.", 
"US-SZ3", "85858", "GRP_SITE_DESC", "This site is located at St. John, WA and currently under a crop rotation that consists of winter and spring crops. This site is under no-tillage management.", 
"US-Ton", "5903", "GRP_SITE_DESC", "Located in the lower foothills of the Sierra Nevada Mountains, the Tonzi Ranch site is classified as an oak savanna woodland on privately owned land. Managed by local rancher, Russell Tonzi, brush has been periodically removed for cattle grazing. The overstory is dominated by blue oak trees (40% of total vegetation) with intermittent grey pine trees (3 trees/ha). Understory species include a variety of grasses and herbs, including purple false brome, smooth cat's ear, and rose clover. These two distinctive layers operate in and out from one another. Growing season of the understory is confined to the wet season only, typically from October to early May. In contrast, the deciduous blue oak trees are dormant during the rainy winter months and reach maximum LAI in April. The blue oak ecosystem rings the Great Central Valley of California, inhabiting the lower reaches of the Sierra Nevada foothills.", 
"US-Tur", "85301", "GRP_SITE_DESC", "Pasture", 
"US-Tw1", "12570", "GRP_SITE_DESC", "The Twitchell Wetland site is a 7.4-acre restored wetland on Twitchell Island, that is managed by the California Department of Water Resources (DWR) and the U.S. Geological Survey (USGS). In the fall of 1997, the site was permanently flooded to a depth of approximately 25 cm. The wetland was almost completely covered by cattails and
tules by the third growing season.  A flux tower equipped to analyze energy, H2O, CO2, and CH4 fluxes was installed on May 17, 2012.", 
"US-Tw2", "11273", "GRP_SITE_DESC", "The Twitchell Corn site is a corn field on peat soil. The tower was installed on May 17, 2012 and was equipped to analyze energy, H2O and CO2 fluxes. The field was planted in early May 2012 and harvested in early November 2012. The field was fallow during the non-growing season. The variety of corn used was ES-7477 hybrid corn commercialized by Eureka seeds. The site is near US-Tw1, US-Tw3 and US-Twt sites.", 
"US-Tw3", "15361", "GRP_SITE_DESC", "The Twitchell Alfalfa site is an alfalfa field owned by the state of California and leased to third parties for farming. The tower was installed on May 24, 2013. This site and the surrounding region are part of the San Joaquin - Sacramento River Delta drained beginning in the 1850's and subsequently used for agriculture. The field has been alfalfa for X years…., Crop rotation occurs every 5-6 years.  The site is harvested by mowing and bailing several times per year.  The field is fallow typically between November and February. The site is irrigated by periodically-flooded ditches surrounding the field. The site is irrigated by raising, and subsequently lowering the water table??", 
"US-Tw4", "11312", "GRP_SITE_DESC", "The Twitchell East End Wetland is a newly constructed restored wetland on Twitchell Island, CA. This site and the surrounding region are part of the San Joaquin - Sacramento River Delta drained beginning in the 1850's and subsequently used for agriculture. The site was previously a corn field. The wetland was designed to have a mix of vegetated and open water channels and ponds (due to surface elevation differences). Flooding of the wetland was done gradually beginning in January, 2014. Berms wind throughout the wetland to allow vehicle access. Tule and Cattail plant material from a nearby wetland were spread along the berms immediately prior to flooding to facilitate plant establishment and stabilization of the berms from wind/water erosion. The tower was installed on November 25, 2013.", 
"US-Tw5", "84616", "GRP_SITE_DESC", "The Twitchell Wetland site is a 6.5 acre restored wetland on Twitchell Island, that is managed by the California Department of Water Resources (DWR) and the U.S. Geological Survey (USGS). In the fall of 1997, the site was permanently flooded to a depth of approximately 55 cm. The wetland remained fairly unvegetated in patches increasing in size towards the east. The site underwent a major disturbance in 2013 when the vegetation was removed to seed a nearby restored wetland. A flux tower equipped to analyze energy, H2O, CO2, and CH4 fluxes was installed on April 17, 2018.", 
"US-Twt", "11942", "GRP_SITE_DESC", "The Twitchell Island site is a rice paddy that is owned by the state and managed by the California Department of Water Resources. While Bare Peat field was leveled for rice planting, the tower was installed on April 3, 2009. The rice paddy was converted from corn in 2007. In Summer 2009, Bispyribac-sodium and Pendimethalin herbicides were applied to the fields prior to rice planting and flooding, then pesticide and fertilizer application took place. Each year after rice is planted in the spring by drilling, the field is flooded. Then, the field is drained in early fall, rice is harvested, and the field site is moved.", 
"US-Tx1", "86559", "GRP_SITE_DESC", "This tower is located at Stiles Farm, a complex of Texas A&M Agrilife Extension Service and Stiles Farm Foundation. The Stiles Farm Foundation is a 2,716 acre farm located in Thrall, Texas in eastern Williamson County. The farm is managed by Texas A&M AgriLife Extension Service as a living demonstration of research-based, profitable, and environmentally suistainable agricultural practices for the Texas Blackland Prairie.", 
"US-Tx2", "79582", "GRP_SITE_DESC", "This tower site is located just 2½ miles from Riesel town’s center. It is a 840-acre Agricultural Research Service experimental watershed facility nicknamed the Riesel Watersheds. The tower is located in Remnant native prairie in otherwise agriculturally intensive area.", 
"US-Tx3", "79541", "GRP_SITE_DESC", "This tower site is located just 2½ miles from Riesel town’s center. It is a 840-acre Agricultural Research Service experimental watershed facility nicknamed the Riesel Watersheds. The tower is located in a crop field grown under best management practices", 
"US-Tx4", "79603", "GRP_SITE_DESC", "This tower site is located just 2½ miles from Riesel town’s center. It is a 840-acre Agricultural Research Service experimental watershed facility nicknamed the Riesel Watersheds. The tower is located in a crop field Crops grown under traditional agricultural practices", 
"US-Tx5", "79631", "GRP_SITE_DESC", "Improved pasture within experimental research farm", 
"US-Tx6", "79651", "GRP_SITE_DESC", "La Copita Demonstration Ranch is a 2726 acre tract of rangeland located in western Jim Wells County, about 40 miles west of Corpus Christi, Texas and approximately 15 miles south and west of Alice. The ranch is located in a transition zone between the northeastern portion of the central Rio Grande Plain and the Gulf Prairie and Marshes. The climate is subtropical with hot summers and mild winters. Extended cold periods are rare. The growing season is approximately 300 days in length. Annual precipitation averages 716 mm, of which 70% falls in April through September. Three out of five years receive less than average rainfall so precipitation is erratic and droughts are often severe.", 
"US-Tx7", "79716", "GRP_SITE_DESC", "La Copita Demonstration Ranch is a 2726 acre tract of rangeland located in western Jim Wells County, about 40 miles west of Corpus Christi, Texas and approximately 15 miles south and west of Alice. The ranch is located in a transition zone between the northeastern portion of the central Rio Grande Plain and the Gulf Prairie and Marshes. The climate is subtropical with hot summers and mild winters. Extended cold periods are rare. The growing season is approximately 300 days in length. Annual precipitation averages 716 mm, of which 70% falls in April through September. Three out of five years receive less than average rainfall so precipitation is erratic and droughts are often severe.", 
"US-Tx8", "86687", "GRP_SITE_DESC", "The site is located on land within the San Bernard Wildlife Refuge, Brazoria County, Texas (29°09'57.9"N 95°49'43.4"W) at an elevation of about 16 m above MSL, and is part of Ecoregion III Western Gulf Coastal Plain and Ecoregion IV Floodplain and Low Terraces, dominated by mixed bottomland hardwood forests (Griffith et al. 2007). Bottomland forests of pecan (Carya illinoensis), water oak (Quercus nigra), southern live oak (Quercus virginiana) and elm (Ulmus spp.) are typical, with some bald cypress (Taxodium distichum) on larger streams. Other common tree species are ash (Fraxinus spp.), sugar hackberry (Celtis laevigata), cottonwood (Populus deltoids) and black willow (Salix nigra). The tree heights range from 15-25 m. The climate of this region is classified as Humid Subtropical (Cfa) under the Köppen–Geiger climate classification system (Koppen 1900). The average annual maximum temperature is approximately 26 °C and the annual minimum temperature is approximately 15 °C. The area receives a mean annual rainfall of 1143 mm, with an average relative humidity of ~70%. The sites are located in the Linnville Bayou watershed of the San Bernard River Basin. As these forests are situated in the floodplain, sloughs are a common occurrence, which inundate significant parts of the forest. The soils are mainly vertisols and alfisols dominated by clay, loam and sandy loam texture. The soils series include Aris fine sandy loam, Bacliff clay, Edna loam, Leton loam, Pledger Clay and Churnabog clay.", 
"US-Tx9", "86611", "GRP_SITE_DESC", "This tower site is located in the San Bernard Wildlife Refuge, which was established in 1969.  It is part of the National Wildlife Refuge System, a national network of lands and waters set aside for the benefit of wildlife, habitat and outdoor recreation. The Refuge provides a vital corridor of habitat for migrating and wintering birds, stretching inland from the Gulf beaches, through the salt marshes (this site - US-Tx9), and into the bottomland forests (US-Tx8) of the Brazos and San Bernard River basins.", 
"US-Uaf", "81361", "GRP_SITE_DESC", "This tower is located near Smith Lake, University of Alaska, Fairbanks. The open black spruce is dominated on discontinuous permafrost.", 
"US-UiA", "87907", "GRP_SITE_DESC", "Field was treated with Potash, lime and diammonium phosphate before planting. Herbicide application included 2,4-D for 2008, 2009. 56 kg/ha nitrogen applied in 2010, 2011, 2012, 2013, 2014, 2016.", 
"US-UiB", "87912", "GRP_SITE_DESC", "Diammonium phosphate, potash & lime fertilizer applied before planting in 2008. Prowl & 2,4-D herbicide used. 2,4-D & accent herbicide applied in 2009. No fertilizer applied. Bicep herbicide applied in 2010 & 2011. 56 kg/ha nitrogen applied in 2014, 2015 & 2016. 45 kg/ha nitrogen applied in 2017.", 
"US-UiC", "87947", "GRP_SITE_DESC", "Field treated with diammonium phosphate, potash & lime before planting in 2008. No herbicide applied. This site was harvested each year for biomass.", 
"US-ULM", "1645", "GRP_SITE_DESC", "This tower is located in the Russell Sage Wildlife Management Area located about 15 km from the ULM campus. Data QA/QC along with data management is carried out in Garrett Hall and Hanna Hall at the University of Louisiana, Monroe campus.", 
"US-UM3", "14781", "GRP_SITE_DESC", "Douglas Lake is a small inland freshwater lake surrounded by an early successional forest.", 
"US-UMB", "12338", "GRP_SITE_DESC", "The UMBS site is located within a protected forest owned by the University of Michigan. Arboreal composition of the forest consists of mid-aged northern hardwoods, conifer understory, aspen, and old growth hemlock. Logging of local white pines began in 1879. In successive years, several other species were harvested. Logging was discontinued in 1980 when the land became protected under the private ownership of the University of Michigan. Patchy low- to high-intensity wildfires occurred yearly from 1880 - 1920, essentially burning the entire region.", 
